{
  "proto": "HBCE-OPERATION-ENVELOPE-v1",
  "kind": "HBCE_CORE_OPERATION_ENVELOPE",
  "version": "v1",
  "operation_id": "SF009-SYNTHETIC-001",
  "protocol_version": "HBCE_PROTOCOL_V1",
  "identity_binding": {
    "identity_ref": "SYNTHETIC-IDENTITY-001",
    "verification_state": "UNKNOWN"
  },
  "authority_binding": {
    "authority_ref": null,
    "authority_version": null,
    "state": "UNRESOLVED"
  },
  "policy_binding": {
    "decision": "UNEVALUATED"
  },
  "authorization_binding": {
    "state": "UNRESOLVED"
  },
  "execution_binding": {
    "state": "NOT_DISPATCHED"
  },
  "evidence_binding": {
    "state": "NONE",
    "references": []
  },
  "state": "CREATED",
  "created_at": "2026-01-19T15:30:00+01:00",
  "updated_at": "2026-01-19T15:30:00+01:00",
  "payload_sha256": "0000000000000000000000000000000000000000000000000000000000000000",
  "append_only": true,
  "genealogy": {
    "previous_operation_version_ref": null,
    "supersedes": null
  },
  "boundary": {
    "identity_is_not_authority": true,
    "policy_allow_is_not_execution": true,
    "ai_output_is_not_authorization": true,
    "deny_prevents_dispatch": true,
    "history_is_non_destructive": true
  }
}
